{
    "$id": "https://github.com/tomGru55/otvRac/blob/main/lab2/oscarsJSON.json",
    "$schema": "http://json-schema.org/draft-07/schema#",
    "type": "array",
    "items": {
        "type": "object",
        "properties": {
            "id": {
                "type": "number",
                "description": "generirani id zapisa"
            },
            "naziv_ceremonije": {
                "type": "string",
                "description": "naziv ceremonije oscar"
            },
            "datum_ceremonije": {
                "type": "string",
                "format": "date",
                "description": "datum ceremonije Oscar"
            },
            "lokacija_ceremonije": {
                "type": "string",
                "description": "mjesto održavanja ceremonije Oscar"
            },
            "nagrade": {
                "type": "object",
                "properties": {
                    "kategorija_nagrade": {
                        "type": "string",
                        "description": "kategorija može biti: Najbolji glumac, Njabolji sporedni glumac, Najbolja glumica, Najbolja sporedna glumica"
                    },
                    "film": {
                        "type": "string",
                        "description": "ime filma za koji je dobitnik nagrađen"
                    },
                    "dobitnik_ime": {
                        "type": "string",
                        "description": "ime dobitnika nagrade Oscar"
                    },
                    "dobitnik_prezime": {
                        "type": "string",
                        "description": "prezime dobitnika nagrade Oscar"
                    },
                    "dobitnik_datumrod": {
                        "type": "string",
                        "format": "date",
                        "description": "\tdatum rođenja dobitnika nagrade Oscar"
                    },
                    "ime_lika_u_filmu": {
                        "type": "string",
                        "description": "\time lika u filmu kojeg je dobitnik nagrade portretirao"
                    },
                    "redatelj": {
                        "type": "string",
                        "description": "redatelj filma za koji je dobitnik nagrađen"
                    }
                },
                "additionalProperties": false,
                "required": [
                    "kategorija_nagrade",
                    "film",
                    "dobitnik_ime",
                    "dobitnik_prezime",
                    "dobitnik_datumrod",
                    "ime_lika_u_filmu",
                    "redatelj"
                ],
                "description": "skup dodijeljenih nagrada na određenoj ceremoniji, na svakoj ceremoniji se dodjeljuje 4 nagrada"
            }
        },
        "required": [
            "naziv_ceremonije",
            "datum_ceremonije",
            "lokacija_ceremonije",
            "nagrade"
        ],
        "additionalProperties": false
    },
    "title": "Oscars Open Data",
    "description": "otvoreni skup podataka koji sadrži podatke o dodjelama nagrade oscar za glumu na ceremonijama oscar"
}